Game Date,Away Team,Away Lineup,Home Team,Home Lineup,Away Score,Home Score
20220713,롯데,"안치홍, 황성빈, 이대호, 전준우, 한동희, 정훈, 피터스, 이호연, 정보근, 반즈",한화,"터크먼, 유로결, 김태연, 김인환, 이진영, 하주석, 최재훈, 변우혁, 박정현, 남지민",0 , 2
20220713,NC,"이명기, 김주원, 권희동, 마티니, 박건우, 오영수, 서호철, 도태훈, 박대온, 이재학",두산,"안권수, 페르난데스, 양석환, 김재환, 허경민, 박세혁, 김재호, 안재석, 양찬열, 스탁",1 , 4
20220714,LG,"박해민, 문성주, 김현수, 채은성, 오지환, 문보경, 유강남, 이재원, 이상호, 플럿코",KIA,"이창진, 김도영, 나성범, 황대인, 최형우, 김선빈, 류지혁, 한승택, 김호령, 파노니",2 , 6
20220714,SSG,"추신수, 최지훈, 최정, 한유섬, 박성한, 전의산, 김성현, 이재원, 오태곤, 폰트",키움,"김준완, 김혜성, 이정후, 푸이그, 송성문, 김휘집, 이주형, 이지영, 이용규, 정찬헌",1 , 4
20220714,롯데,"안치홍, 전준우, 이대호, 정훈, 한동희, 고승민, 피터스, 이학주, 안중열, 스파크맨",한화,"터크먼, 김태연, 정은원, 김인환, 이진영, 하주석, 박상언, 노수광, 박정현, 페냐",7 , 10
20220714,NC,"이명기, 김주원, 박건우, 양의지, 마티니, 권희동, 오영수, 서호철, 도태훈, 루친스키",두산,"허경민, 안권수, 페르난데스, 김재환, 양석환, 박세혁, 김재호, 안재석, 홍성호, 최원준",11 , 3
20220714,KT,"조용호, 배정대, 알포드, 박병호, 장성우, 황재균, 오윤석, 김민혁, 심우준, 고영표",삼성,"김현준, 피렐라, 오재일, 이원석, 김재성, 강민호, 김성윤, 이재현, 오선진, 뷰캐넌",0 , 1
20220722,두산,"허경민, 강승호, 페르난데스, 김재환, 양석환, 김재호, 박세혁, 정수빈, 김대한, 스탁",SSG,"추신수, 최지훈, 최정, 한유섬, 박성한, 전의산, 최주환, 이재원, 오태곤, 김광현",1 , 0
20220722,롯데,"안치홍, 황성빈, 이대호, 전준우, 한동희, 정훈, 안중열, 박승욱, 조세진, 반즈",KIA,"박찬호, 이창진, 나성범, 황대인, 김선빈, 이우성, 김호령, 한승택, 김도영, 파노니",5 , 2
20220722,NC,"박민우, 이명기, 박건우, 마티니, 양의지, 권희동, 노진혁, 김주원, 오영수, 구창모",LG,"박해민, 문성주, 김현수, 채은성, 오지환, 문보경, 이재원, 유강남, 손호영, 켈리",4 , 5
20220722,키움,"김준완, 김혜성, 이정후, 푸이그, 송성문, 김수환, 이주형, 이지영, 김휘집, 안우진",삼성,"김현준, 구자욱, 피렐라, 오재일, 이원석, 강민호, 이재현, 이해승, 오선진, 원태인",2 , 3
20220722,한화,"터크먼, 김태연, 정은원, 노시환, 김인환, 하주석, 이진영, 최재훈, 유로결, 라미레즈",KT,"조용호, 김민혁, 알포드, 박병호, 황재균, 배정대, 김준태, 오윤석, 장준원, 벤자민",0 , 8
20220723,롯데,"안치홍, 황성빈, 이대호, 전준우, 한동희, 정훈, 조세진, 이학주, 정보근, 박세웅",KIA,"박찬호, 이창진, 나성범, 황대인, 최형우, 김선빈, 류지혁, 한승택, 김호령, 양현종",9 , 3
20220723,NC,"박민우, 이명기, 박건우, 양의지, 마티니, 권희동, 노진혁, 오영수, 김주원, 이용준",LG,"박해민, 문성주, 오지환, 채은성, 문보경, 유강남, 서건창, 이재원, 손호영, 김윤식",11 , 5
20220723,키움,"김준완, 김혜성, 이정후, 송성문, 김휘집, 이지영, 김주형, 전병우, 이용규, 요키시",삼성,"김현준, 구자욱, 피렐라, 오재일, 이원석, 강민호, 이재현, 김헌곤, 오선진, 뷰캐넌",0 , 6
20220723,한화,"터크먼, 김태연, 정은원, 노시환, 김인환, 하주석, 장진혁, 최재훈, 노수광, 김민우",KT,"조용호, 배정대, 알포드, 박병호, 장성우, 황재균, 김민혁, 오윤석, 신본기, 고영표",5 , 3
20220724,두산,"안권수, 페르난데스, 양석환, 김재환, 허경민, 박세혁, 안재석, 박계범, 정수빈, 곽빈",SSG,"추신수, 최지훈, 최정, 한유섬, 박성한, 전의산, 김강민, 이재원, 김성현, 폰트",5 , 4
20220724,롯데,"안치홍, 황성빈, 이대호, 전준우, 렉스, 한동희, 정훈, 안중열, 이호연, 스파크맨",KIA,"박찬호, 이창진, 나성범, 황대인, 최형우, 김선빈, 류지혁, 한승택, 김호령, 이의리",23 , 0
20220724,NC,"박민우, 이명기, 박건우, 양의지, 마티니, 권희동, 노진혁, 김주원, 도태훈, 루친스키",LG,"박해민, 문성주, 오지환, 채은성, 서건창, 문보경, 유강남, 이재원, 이영빈, 배재준",1 , 6
20220724,키움,"김준완, 김혜성, 이정후, 송성문, 김휘집, 푸이그, 이주형, 김시앙, 이용규, 애플러",삼성,"김현준, 구자욱, 피렐라, 오재일, 강민호, 김재성, 이원석, 이재현, 오선진, 허윤동",8 , 0
20220724,한화,"터크먼, 김태연, 정은원, 노시환, 김인환, 하주석, 이진영, 장진혁, 박상언, 페냐",KT,"조용호, 배정대, 알포드, 박병호, 장성우, 황재균, 김민혁, 오윤석, 신본기, 소형준",3 , 1
20220726,두산,"허경민, 페르난데스, 양석환, 김재환, 김재호, 강승호, 강진성, 박세혁, 김태근, 최원준",롯데,"안치홍, 전준우, 이대호, 렉스, 정훈, 한동희, 고승민, 정보근, 이학주, 김진욱",1 , 6
20220726,SSG,"추신수, 최지훈, 박성한, 최정, 한유섬, 전의산, 라가레스, 이재원, 최주환, 오원석",LG,"박해민, 문성주, 김현수, 채은성, 가르시아, 오지환, 유강남, 문보경, 이재원, 플럿코",9 , 0
20220726,삼성,"김현준, 구자욱, 피렐라, 오재일, 이원석, 김재성, 김상수, 이재현, 오선진, 백정현",한화,"터크먼, 이진영, 정은원, 노시환, 김인환, 하주석, 최재훈, 장진혁, 박정현, 장민재",4 , 2
20220726,KT,"조용호, 김민혁, 알포드, 박병호, 황재균, 김준태, 배정대, 양승혁, 신본기, 데스파이네",키움,"이용규, 김혜성, 이정후, 송성문, 김휘집, 푸이그, 이병규, 김시앙, 김준완, 한현희",8 , 7
20220726,KIA,"박찬호, 이창진, 나성범, 황대인, 최형우, 김선빈, 류지혁, 한승택, 김호령, 임기영",NC,"박민우, 이명기, 박건우, 양의지, 마티니, 손아섭, 권희동, 노진혁, 김주원, 신민혁",9 , 1
20220727,두산,"안권수, 페르난데스, 양석환, 김재환, 박세혁, 허경민, 김재호, 안재석, 김태근, 이영하",롯데,"황성빈, 안치홍, 한동희, 전준우, 이대호, 렉스, 정훈, 이학주, 안중열, 이인복",5 , 6
20220727,SSG,"추신수, 최지훈, 최정, 전의산, 박성한, 한유섬, 라가레스, 김민식, 김성현, 모리만도",LG,"박해민, 문성주, 김현수, 채은성, 가르시아, 오지환, 유강남, 문보경, 이재원, 임찬규",3 , 6
20220727,삼성,"김현준, 구자욱, 피렐라, 오재일, 이원석, 김태군, 김상수, 이재현, 오선진, 수아레즈",한화,"터크먼, 김태연, 정은원, 노시환, 김인환, 하주석, 장진혁, 최재훈, 노수광, 남지민",10 , 11
20220727,KT,"조용호, 배정대, 알포드, 박병호, 장성우, 황재균, 김준태, 양승혁, 심우준, 엄상백",키움,"이용규, 김혜성, 이정후, 송성문, 김휘집, 박찬혁, 이지영, 푸이그, 김준완, 정찬헌",4 , 5
20220727,KIA,"박찬호, 이창진, 나성범, 황대인, 최형우, 김선빈, 류지혁, 박동원, 김호령, 놀린",NC,"박민우, 손아섭, 박건우, 양의지, 마티니, 권희동, 노진혁, 박준영, 박대온, 이재학",5 , 9
20220728,두산,"허경민, 페르난데스, 양석환, 김재환, 김재호, 박계범, 안권수, 강진성, 안승한, 스탁",롯데,"렉스, 고승민, 전준우, 이대호, 안치홍, 한동희, 이호연, 안중열, 이학주, 반즈",5 , 8
20220728,SSG,"추신수, 최지훈, 최정, 전의산, 박성한, 한유섬, 라가레스, 이재원, 김성현, 김광현",LG,"박해민, 문성주, 김현수, 가르시아, 오지환, 유강남, 문보경, 이재원, 서건창, 켈리",4 , 5
20220728,삼성,"김현준, 구자욱, 피렐라, 오재일, 이원석, 김태군, 강민호, 김지찬, 오선진, 원태인",한화,"터크먼, 김태연, 정은원, 노시환, 김인환, 하주석, 이진영, 박상언, 유로결, 라미레즈",3 , 3
20220728,KT,"조용호, 배정대, 알포드, 박병호, 장성우, 황재균, 문상철, 신본기, 심우준, 벤자민",키움,"이용규, 김혜성, 이정후, 송성문, 김휘집, 푸이그, 이지영, 박찬혁, 김태진, 안우진",2 , 8
20220728,KIA,"박찬호, 이창진, 나성범, 황대인, 최형우, 김선빈, 박동원, 김호령, 김도영, 파노니",NC,"박민우, 손아섭, 박건우, 양의지, 마티니, 권희동, 노진혁, 김주원, 이명기, 구창모",6 , 2
20220729,LG,"홍창기, 박해민, 김현수, 가르시아, 오지환, 문성주, 문보경, 서건창, 허도환, 김윤식",KT,"조용호, 김민혁, 알포드, 박병호, 장성우, 황재균, 배정대, 박경수, 심우준, 고영표",5 , 4
20220729,삼성,"김현준, 구자욱, 피렐라, 이원석, 김재성, 강민호, 김상수, 김지찬, 오선진, 황동재",롯데,"렉스, 황성빈, 한동희, 전준우, 이대호, 안치홍, 정훈, 이학주, 정보근, 스파크맨",7 , 8
20220729,NC,"박민우, 손아섭, 박건우, 양의지, 마티니, 권희동, 노진혁, 김주원, 이명기, 송명기",키움,"김준완, 이용규, 이정후, 김혜성, 푸이그, 송성문, 이지영, 김주형, 김태진, 요키시",3 , 5
20220729,KIA,"박찬호, 이창진, 나성범, 황대인, 최형우, 김선빈, 류지혁, 한승택, 김호령, 양현종",SSG,"추신수, 최지훈, 라가레스, 최정, 박성한, 김강민, 전의산, 김성현, 김민식, 이태양",2 , 11
20220729,한화,"터크먼, 김태연, 정은원, 노시환, 하주석, 박정현, 장진혁, 최재훈, 장운호, 김민우",두산,"허경민, 김인태, 페르난데스, 김재환, 양석환, 안권수, 박세혁, 안재석, 박계범, 최승용",7 , 3
20220730,LG,"홍창기, 박해민, 김현수, 가르시아, 오지환, 문성주, 문보경, 유강남, 이영빈, 배재준",KT,"조용호, 배정대, 알포드, 박병호, 장성우, 황재균, 문상철, 박경수, 심우준, 소형준",7 , 8
20220730,삼성,"김현준, 구자욱, 피렐라, 이원석, 김재성, 강민호, 김상수, 김지찬, 오선진, 허윤동",롯데,"안치홍, 전준우, 이대호, 렉스, 한동희, 정훈, 황성빈, 정보근, 이학주, 박세웅",9 , 8
20220730,NC,"박민우, 손아섭, 박건우, 양의지, 마티니, 권희동, 노진혁, 김주원, 이명기, 루친스키",키움,"김준완, 김혜성, 이정후, 푸이그, 송성문, 김휘집, 김태진, 이지영, 이용규, 최원태",3 , 3
20220730,KIA,"박찬호, 이창진, 나성범, 황대인, 최형우, 김선빈, 류지혁, 박동원, 김호령, 이의리",SSG,"추신수, 최지훈, 최정, 전의산, 김강민, 박성한, 라가레스, 이재원, 김성현, 폰트",7 , 5
20220730,한화,"터크먼, 장진혁, 정은원, 노시환, 하주석, 김인환, 최재훈, 노수광, 박정현, 페냐",두산,"허경민, 김인태, 페르난데스, 김재환, 양석환, 박세혁, 안권수, 안재석, 강승호, 박신지",1 , 11
20220731,삼성,"김현준, 구자욱, 피렐라, 이원석, 김재성, 강민호, 김상수, 김지찬, 오선진, 최하늘",롯데,"렉스, 황성빈, 한동희, 전준우, 이대호, 정훈, 안치홍, 이학주, 안중열, 이민석",5 , 5
20220731,KIA,"박찬호, 이창진, 나성범, 황대인, 최형우, 김선빈, 류지혁, 박동원, 김호령, 임기영",SSG,"추신수, 최지훈, 최정, 전의산, 박성한, 한유섬, 라가레스, 이재원, 김성현, 박종훈",3 , 2
20220802,롯데,"렉스, 황성빈, 한동희, 전준우, 이대호, 안치홍, 정훈, 이학주, 정보근, 이인복",LG,"홍창기, 박해민, 김현수, 채은성, 가르시아, 오지환, 문성주, 유강남, 문보경, 플럿코",3 , 4
20220802,키움,"김준완, 김휘집, 이정후, 푸이그, 송성문, 박찬혁, 이지영, 김주형, 이용규, 정찬헌",SSG,"추신수, 최지훈, 최정, 전의산, 박성한, 한유섬, 라가레스, 김민식, 김성현, 모리만도",7 , 5
20220802,한화,"터크먼, 장진혁, 정은원, 노시환, 하주석, 김인환, 김태연, 최재훈, 장운호, 장민재",KIA,"박찬호, 소크라테스, 이창진, 나성범, 황대인, 최형우, 박동원, 류지혁, 김선빈, 놀린",4 , 5
20220803,두산,"허경민, 김인태, 페르난데스, 김재환, 양석환, 박세혁, 안권수, 김재호, 안재석, 최원준",삼성,"김현준, 강한울, 피렐라, 구자욱, 오재일, 김태군, 김재성, 김지찬, 김상수, 수아레즈",1 , 3
20220803,롯데,"안치홍, 렉스, 이대호, 전준우, 한동희, 이호연, 지시완, 이학주, 황성빈, 반즈",LG,"홍창기, 박해민, 김현수, 채은성, 가르시아, 문성주, 유강남, 문보경, 이영빈, 임찬규",4 , 1
20220803,NC,"박민우, 손아섭, 박건우, 양의지, 마티니, 권희동, 노진혁, 김주원, 이명기, 구창모",KT,"조용호, 배정대, 알포드, 박병호, 황재균, 김민혁, 박경수, 김준태, 심우준, 데스파이네",15 , 2
20220803,키움,"김준완, 송성문, 이정후, 푸이그, 김혜성, 박찬혁, 김휘집, 이지영, 김태진, 안우진",SSG,"추신수, 최지훈, 최정, 한유섬, 박성한, 김강민, 전의산, 이재원, 최주환, 김광현",2 , 3
20220803,한화,"터크먼, 장진혁, 정은원, 노시환, 하주석, 김인환, 김태연, 최재훈, 장운호, 남지민",KIA,"박찬호, 소크라테스, 이창진, 나성범, 황대인, 최형우, 김선빈, 박동원, 류지혁, 파노니",6 , 3
20220804,두산,"허경민, 김인태, 페르난데스, 김재환, 양석환, 박세혁, 안권수, 김재호, 안재석, 이영하",삼성,"김지찬, 김현준, 구자욱, 피렐라, 오재일, 김재성, 강한울, 강민호, 오선진, 원태인",9 , 2
20220804,롯데,"렉스, 안치홍, 한동희, 전준우, 이대호, 지시완, 배성근, 박승욱, 황성빈, 박세웅",LG,"박해민, 문성주, 김현수, 채은성, 오지환, 가르시아, 문보경, 이재원, 허도환, 김윤식",12 , 2
20220804,NC,"손아섭, 권희동, 박건우, 양의지, 마티니, 노진혁, 천재환, 김주원, 박준영, 송명기",KT,"조용호, 배정대, 알포드, 박병호, 김민혁, 김준태, 신본기, 권동진, 심우준, 벤자민",3 , 4
20220804,키움,"이용규, 송성문, 이정후, 푸이그, 김혜성, 박찬혁, 김휘집, 이지영, 김태진, 요키시",SSG,"추신수, 최지훈, 김강민, 최정, 라가레스, 박성한, 오태곤, 김민식, 김성현, 이태양",6 , 5
20220804,한화,"터크먼, 김태연, 정은원, 노시환, 하주석, 김인환, 노수광, 박상언, 이원석, 라미레즈",KIA,"박찬호, 이창진, 나성범, 황대인, 소크라테스, 최형우, 김선빈, 한승택, 김도영, 양현종",1 , 4
20220805,LG,"박해민, 문성주, 김현수, 채은성, 오지환, 가르시아, 문보경, 유강남, 홍창기, 켈리",키움,"김준완, 김태진, 이정후, 푸이그, 김혜성, 김휘집, 송성문, 이지영, 박준태, 최원태",8 , 7
20220805,SSG,"추신수, 최지훈, 최정, 한유섬, 박성한, 김강민, 전의산, 이재원, 김성현, 폰트",삼성,"김지찬, 김현준, 김재성, 피렐라, 오재일, 구자욱, 이원석, 강민호, 강한울, 황동재",3 , 1
20220805,롯데,"황성빈, 고승민, 안치홍, 렉스, 이대호, 이호연, 이학주, 강태율, 박승욱, 나균안",NC,"박민우, 손아섭, 박건우, 양의지, 마티니, 노진혁, 이명기, 김주원, 박대온, 신민혁",2 , 7
20220805,KT,"조용호, 황재균, 김민혁, 알포드, 장성우, 배정대, 박경수, 김태훈, 심우준, 고영표",한화,"터크먼, 노수광, 정은원, 노시환, 하주석, 김인환, 장진혁, 최재훈, 박정현, 김민우",1 , 5
20220805,KIA,"박찬호, 김선빈, 나성범, 황대인, 소크라테스, 박동원, 이우성, 김호령, 김도영, 이의리",두산,"허경민, 김인태, 양석환, 페르난데스, 송승환, 김재호, 박세혁, 강승호, 정수빈, 브랜든",5 , 3
20220806,LG,"홍창기, 박해민, 김현수, 채은성, 오지환, 이재원, 가르시아, 문보경, 유강남, 이민호",키움,"김준완, 송성문, 이정후, 푸이그, 김혜성, 김휘집, 김태진, 박찬혁, 김시앙, 한현희",3 , 12
20220806,SSG,"추신수, 최지훈, 최정, 한유섬, 하재훈, 전의산, 김성현, 이재원, 최주환, 박종훈",삼성,"김지찬, 김현준, 구자욱, 피렐라, 오재일, 강민호, 이원석, 김태군, 김상수, 허윤동",6 , 7
20220806,롯데,"황성빈, 고승민, 안치홍, 렉스, 이대호, 이호연, 이학주, 강태율, 박승욱, 최영환",NC,"박민우, 손아섭, 박건우, 양의지, 마티니, 권희동, 노진혁, 김주원, 이명기, 루친스키",10 , 1
20220806,KT,"조용호, 황재균, 알포드, 박병호, 장성우, 김민혁, 배정대, 박경수, 심우준, 소형준",한화,"터크먼, 김태연, 정은원, 노시환, 하주석, 김인환, 장진혁, 최재훈, 장운호, 페냐",2 , 4
20220806,KIA,"박찬호, 이창진, 나성범, 황대인, 소크라테스, 최형우, 김선빈, 박동원, 김도영, 임기영",두산,"안권수, 김인태, 양석환, 페르난데스, 송승환, 박세혁, 허경민, 안재석, 김재호, 스탁",7 , 4
20220807,LG,"홍창기, 박해민, 김현수, 채은성, 오지환, 문성주, 가르시아, 문보경, 유강남, 플럿코",키움,"이용규, 김휘집, 이정후, 푸이그, 김혜성, 이지영, 김태진, 송성문, 김준완, 애플러",0 , 5
20220807,SSG,"최지훈, 전의산, 추신수, 최정, 박성한, 김강민, 한유섬, 김민식, 최주환, 모리만도",삼성,"김지찬, 김현준, 오선진, 피렐라, 김재성, 이원석, 구자욱, 강한울, 송준석, 장필준",6 , 7
20220807,롯데,"렉스, 고승민, 한동희, 이대호, 안치홍, 추재현, 이학주, 지시완, 박승욱, 이인복",NC,"박민우, 손아섭, 박건우, 양의지, 마티니, 권희동, 노진혁, 박준영, 도태훈, 김태경",14 , 0
20220807,KT,"조용호, 김민혁, 알포드, 박병호, 장성우, 황재균, 배정대, 신본기, 심우준, 엄상백",한화,"터크먼, 정은원, 노시환, 김인환, 하주석, 장운호, 박상언, 박정현, 이원석, 장민재",6 , 5
20220807,KIA,"박찬호, 이창진, 나성범, 황대인, 소크라테스, 최형우, 김선빈, 박동원, 류지혁, 놀린",두산,"허경민, 정수빈, 양석환, 페르난데스, 송승환, 김재호, 강승호, 안승한, 안권수, 곽빈",4 , 5
20220810,두산,"허경민, 김인태, 양석환, 페르난데스, 박세혁, 김재호, 안재석, 정수빈, 송승환, 최원준",NC,"박민우, 손아섭, 박건우, 양의지, 마티니, 노진혁, 김주원, 도태훈, 이명기, 이재학",11 , 0
20220810,SSG,"추신수, 최지훈, 라가레스, 최정, 김강민, 박성한, 오태곤, 이재원, 김성현, 김광현",KT,"조용호, 배정대, 알포드, 박병호, 장성우, 황재균, 김민혁, 박경수, 심우준, 벤자민",2 , 4
20220810,삼성,"김지찬, 김현준, 김재성, 피렐라, 오재일, 구자욱, 김태군, 강한울, 김상수, 수아레즈",KIA,"박찬호, 이창진, 나성범, 황대인, 소크라테스, 최형우, 김선빈, 박동원, 류지혁, 파노니",2 , 3
20220810,키움,"김준완, 김혜성, 이정후, 푸이그, 김휘집, 이지영, 송성문, 전병우, 김태진, 안우진",롯데,"황성빈, 렉스, 한동희, 이대호, 정훈, 이호연, 박승욱, 정보근, 장두성, 스트레일리",4 , 3
20220811,두산,"정수빈, 김인태, 양석환, 페르난데스, 허경민, 박세혁, 안재석, 김재호, 조수행, 브랜든",NC,"박민우, 손아섭, 박건우, 마티니, 권희동, 노진혁, 김주원, 박대온, 이명기, 신민혁",3 , 2
20220811,SSG,"추신수, 최지훈, 전의산, 최정, 박성한, 라가레스, 한유섬, 김민식, 김성현, 오원석",KT,"조용호, 배정대, 알포드, 박병호, 황재균, 김준태, 박경수, 신본기, 심우준, 데스파이네",2 , 4
20220811,키움,"김준완, 김혜성, 이정후, 푸이그, 송성문, 임지열, 이주형, 이지영, 김휘집, 요키시",롯데,"신용수, 황성빈, 한동희, 렉스, 정훈, 김민수, 한태양, 강태율, 장두성, 반즈",3 , 0
20220812,두산,"정수빈, 김인태, 허경민, 페르난데스, 양석환, 박세혁, 안재석, 김재호, 양찬열, 스탁",NC,"박민우, 손아섭, 박건우, 마티니, 권희동, 이명기, 노진혁, 박대온, 김주원, 루친스키",1 , 7
20220812,SSG,"최지훈, 전의산, 최정, 한유섬, 박성한, 라가레스, 최주환, 이재원, 김성현, 폰트",KT,"조용호, 김민혁, 알포드, 박병호, 장성우, 황재균, 배정대, 신본기, 심우준, 고영표",9 , 5
20220812,삼성,"김지찬, 이성규, 구자욱, 피렐라, 이원석, 오재일, 김상수, 강민호, 김성표, 원태인",KIA,"박찬호, 이창진, 나성범, 황대인, 소크라테스, 최형우, 김선빈, 박동원, 류지혁, 양현종",6 , 7
20220812,키움,"김태진, 김혜성, 이정후, 푸이그, 송성문, 임지열, 이주형, 이지영, 신준우, 최원태",롯데,"렉스, 황성빈, 이대호, 전준우, 한동희, 정훈, 이호연, 정보근, 박승욱, 박세웅",4 , 1
20220812,한화,"터크먼, 정은원, 노시환, 김인환, 하주석, 김태연, 장진혁, 최재훈, 노수광, 라미레즈",LG,"홍창기, 박해민, 김현수, 채은성, 오지환, 문성주, 가르시아, 문보경, 유강남, 이민호",6 , 5
20220813,두산,"정수빈, 김인태, 허경민, 페르난데스, 양석환, 박세혁, 안재석, 강승호, 조수행, 이영하",SSG,"추신수, 최지훈, 최정, 한유섬, 박성한, 라가레스, 전의산, 최주환, 김민식, 박종훈",8 , 2
20220813,KT,"조용호, 김민혁, 알포드, 박병호, 장성우, 황재균, 배정대, 신본기, 심우준, 엄상백",삼성,"김지찬, 김현준, 구자욱, 피렐라, 오재일, 이원석, 강한울, 강민호, 김성윤, 황동재",1 , 8
20220813,KIA,"박찬호, 이창진, 나성범, 최형우, 소크라테스, 김선빈, 황대인, 한승택, 김도영, 이의리",롯데,"신용수, 정훈, 한동희, 전준우, 이대호, 김민수, 황성빈, 정보근, 박승욱, 나균안",0 , 9
20220813,한화,"터크먼, 정은원, 노시환, 김인환, 하주석, 김태연, 노수광, 박상언, 장운호, 남지민",키움,"이용규, 김혜성, 이정후, 푸이그, 송성문, 임지열, 김태진, 김재현, 김휘집, 애플러",8 , 6
20220814,두산,"허경민, 정수빈, 양석환, 페르난데스, 강승호, 김재호, 김인태, 안승한, 김대한, 곽빈",SSG,"추신수, 최지훈, 최정, 한유섬, 전의산, 라가레스, 박성한, 최주환, 이재원, 모리만도",5 , 4
20220814,NC,"박민우, 손아섭, 박건우, 양의지, 마티니, 노진혁, 이명기, 김주원, 박대온, 김태경",LG,"홍창기, 박해민, 김현수, 채은성, 오지환, 문성주, 가르시아, 문보경, 유강남, 임찬규",2 , 6
20220814,KT,"조용호, 배정대, 알포드, 박병호, 장성우, 황재균, 김민혁, 박경수, 심우준, 배제성",삼성,"김지찬, 강한울, 구자욱, 피렐라, 오재일, 이원석, 김현준, 강민호, 김상수, 백정현",2 , 3
20220814,KIA,"박찬호, 김도영, 나성범, 최형우, 소크라테스, 이창진, 류지혁, 한승택, 김규성, 놀린",롯데,"렉스, 정훈, 전준우, 이대호, 한동희, 김민수, 강태율, 신용수, 박승욱, 서준원",5 , 1
20220814,한화,"터크먼, 정은원, 노시환, 김인환, 하주석, 장진혁, 최재훈, 노수광, 박정현, 페냐",키움,"이용규, 김혜성, 이정후, 푸이그, 김태진, 임지열, 김재현, 김휘집, 송성문, 정찬헌",12 , 8
20220816,LG,"홍창기, 박해민, 김현수, 채은성, 오지환, 문성주, 가르시아, 문보경, 유강남, 플럿코",삼성,"김지찬, 김상수, 구자욱, 피렐라, 오재일, 이원석, 강한울, 김태군, 김헌곤, 수아레즈",3 , 6
20220816,KT,"조용호, 배정대, 알포드, 박병호, 황재균, 김민혁, 신본기, 김준태, 심우준, 데스파이네",키움,"이용규, 김혜성, 이정후, 푸이그, 김태진, 임지열, 송성문, 이지영, 김휘집, 안우진",4 , 5
20220817,LG,"홍창기, 박해민, 김현수, 채은성, 오지환, 문성주, 가르시아, 허도환, 김민성, 김윤식",삼성,"김상수, 오선진, 구자욱, 피렐라, 이원석, 강한울, 이성규, 김재성, 김헌곤, 양창섭",7 , 11
20220817,롯데,"렉스, 정훈, 전준우, 이대호, 안치홍, 한동희, 황성빈, 강태율, 박승욱, 반즈",두산,"허경민, 김인태, 양석환, 페르난데스, 강승호, 안승한, 김대한, 전민재, 정수빈, 최원준",6 , 8
20220817,NC,"박민우, 손아섭, 박건우, 양의지, 마티니, 노진혁, 권희동, 오영수, 김주원, 이재학",한화,"터크먼, 정은원, 노시환, 김인환, 하주석, 김태연, 장진혁, 최재훈, 장운호, 김민우",4 , 6
20220817,KT,"배정대, 강백호, 알포드, 박병호, 황재균, 조용호, 박경수, 김준태, 심우준, 벤자민",키움,"이용규, 김혜성, 이정후, 푸이그, 김휘집, 임지열, 송성문, 김수환, 이지영, 요키시",2 , 3
20220817,KIA,"박찬호, 이창진, 나성범, 최형우, 소크라테스, 김선빈, 황대인, 박동원, 김도영, 파노니",SSG,"추신수, 최지훈, 최정, 한유섬, 전의산, 라가레스, 박성한, 이재원, 김성현, 김광현",3 , 4
