Game Date,Away Team,Away Lineup,Home Team,Home Lineup,Away Score,Home Score
20190704,KT,"김민혁, 오태곤, 조용호, 유한준, 로하스, 황재균, 박경수, 장성우, 심우준, 쿠에바스",삼성,"김상수, 구자욱, 김헌곤, 러프, 이원석, 이학주, 박해민, 최영진, 김도환, 윤성환",3 , 5
20190704,KIA,"이명기, 박찬호, 터커, 최형우, 김주찬, 이창진, 김선빈, 한승택, 최원준, 차명진",NC,"박민우, 김태진, 박석민, 모창민, 이원재, 이우성, 노진혁, 김형준, 권희동, 구창모",9 , 3
20190705,두산,"박건우, 페르난데스, 최주환, 김재환, 오재일, 김재호, 허경민, 박세혁, 정수빈, 후랭코프",SK,"노수광, 한동민, 최정, 로맥, 고종욱, 정의윤, 이재원, 최항, 김성현, 박종훈",8 , 6
20190705,키움,"이정후, 김하성, 샌즈, 박병호, 임병욱, 박동원, 송성문, 장영석, 이지영, 신재영",롯데,"민병헌, 손아섭, 전준우, 이대호, 윌슨, 이병규, 강로한, 나종덕, 신본기, 장시환",1 , 14
20190705,한화,"정은원, 오선진, 호잉, 김태균, 송광민, 정근우, 양성우, 지성준, 변우혁, 김범수",KT,"김민혁, 오태곤, 조용호, 유한준, 로하스, 황재균, 박경수, 장성우, 심우준, 알칸타라",10 , 3
20190705,KIA,"이명기, 박찬호, 터커, 최형우, 김주찬, 유민상, 이창진, 한승택, 김선빈, 양현종",LG,"이천웅, 정주현, 이형종, 김현수, 유강남, 오지환, 류형우, 이성우, 구본혁, 김대현",1 , 6
20190705,NC,"박민우, 김태진, 박석민, 모창민, 이원재, 이우성, 노진혁, 김형준, 권희동, 이재학",삼성,"김상수, 구자욱, 김헌곤, 러프, 이원석, 이학주, 김동엽, 강민호, 박해민, 헤일리",3 , 7
20190706,두산,"박건우, 페르난데스, 최주환, 김재환, 김재호, 오재일, 허경민, 박세혁, 정수빈, 이용찬",SK,"노수광, 한동민, 최정, 로맥, 고종욱, 정의윤, 이재원, 최항, 김성현, 김광현",4 , 2
20190706,키움,"김하성, 박동원, 샌즈, 박병호, 장영석, 임병욱, 이지영, 송성문, 박정음, 브리검",롯데,"민병헌, 손아섭, 전준우, 이대호, 윌슨, 정훈, 강로한, 나종덕, 신본기, 레일리",4 , 6
20190706,한화,"정은원, 정근우, 송광민, 호잉, 김태균, 이성열, 최재훈, 유장혁, 오선진, 박주홍",KT,"김민혁, 오태곤, 조용호, 유한준, 로하스, 황재균, 박경수, 장성우, 심우준, 김민수",8 , 9
20190706,KIA,"이창진, 박찬호, 터커, 최형우, 김주찬, 이우성, 이범호, 김민식, 김선빈, 윌랜드",LG,"이천웅, 정주현, 이형종, 김현수, 유강남, 오지환, 김용의, 이성우, 구본혁, 차우찬",0 , 7
20190706,NC,"이명기, 김태진, 박민우, 박석민, 이원재, 노진혁, 권희동, 김형준, 김찬형, 최성영",삼성,"김상수, 구자욱, 김헌곤, 러프, 이원석, 이학주, 최영진, 강민호, 박해민, 원태인",2 , 2
20190707,두산,"박건우, 페르난데스, 최주환, 김재환, 오재일, 김재호, 박세혁, 류지혁, 정수빈, 이영하",SK,"노수광, 한동민, 최정, 로맥, 고종욱, 정의윤, 이재원, 최항, 최경모, 산체스",4 , 5
20190707,키움,"김하성, 이정후, 샌즈, 박병호, 송성문, 박동원, 임병욱, 이지영, 김혜성, 양현",롯데,"민병헌, 손아섭, 전준우, 이대호, 윌슨, 이병규, 강로한, 나종덕, 신본기, 박세웅",2 , 5
20190707,한화,"정은원, 정근우, 송광민, 호잉, 이성열, 김태균, 오선진, 최재훈, 유장혁, 서폴드",KT,"김민혁, 박승욱, 조용호, 유한준, 로하스, 황재균, 박경수, 장성우, 심우준, 김민",4 , 3
20190707,KIA,"최원준, 박찬호, 터커, 최형우, 유민상, 이창진, 오선우, 한승택, 오정환, 김기훈",LG,"이천웅, 정주현, 이형종, 김현수, 유강남, 김민성, 오지환, 김용의, 구본혁, 윌슨",10 , 9
20190707,NC,"이명기, 이상호, 박석민, 양의지, 모창민, 권희동, 노진혁, 김형준, 김성욱, 루친스키",삼성,"김상수, 박해민, 구자욱, 러프, 김헌곤, 이원석, 김동엽, 강민호, 김성훈, 백정현",4 , 2
20190709,LG,"이천웅, 정주현, 이형종, 김현수, 서상우, 유강남, 김민성, 오지환, 김용의, 켈리",두산,"박건우, 페르난데스, 최주환, 김재환, 오재일, 김재호, 박세혁, 허경민, 정수빈, 린드블럼",11 , 4
20190709,KT,"김민혁, 오태곤, 황재균, 유한준, 로하스, 박경수, 윤석민, 장성우, 심우준, 배제성",키움,"이정후, 김하성, 샌즈, 박병호, 송성문, 박동원, 임병욱, 이지영, 김혜성, 요키시",12 , 3
20190709,한화,"정은원, 정근우, 송광민, 호잉, 김태균, 이성열, 최재훈, 유장혁, 강경학, 채드벨",SK,"김강민, 한동민, 최정, 로맥, 정의윤, 고종욱, 이재원, 나주환, 김성현, 소사",0 , 1
20190709,삼성,"김상수, 박해민, 이원석, 러프, 이학주, 김동엽, 강민호, 공민규, 이성곤, 맥과이어",KIA,"이창진, 박찬호, 터커, 최형우, 안치홍, 김주찬, 이우성, 한승택, 김선빈, 터너",2 , 3
20190709,롯데,"손아섭, 나경민, 윌슨, 전준우, 이병규, 이대호, 강로한, 나종덕, 신본기, 서준원",NC,"박민우, 이명기, 박석민, 양의지, 모창민, 이원재, 노진혁, 권희동, 김태진, 박진우",1 , 4
20190711,LG,"이천웅, 정주현, 이형종, 김현수, 유강남, 김민성, 오지환, 서상우, 김용의, 이우찬",두산,"박건우, 페르난데스, 최주환, 김재환, 오재일, 김재호, 박세혁, 허경민, 정수빈, 유희관",8 , 4
20190711,KT,"김민혁, 박승욱, 조용호, 유한준, 로하스, 황재균, 박경수, 장성우, 심우준, 쿠에바스",키움,"이정후, 김하성, 샌즈, 박병호, 송성문, 박동원, 임병욱, 이지영, 김혜성, 신재영",4 , 2
20190711,한화,"정은원, 양성우, 송광민, 호잉, 김태균, 이성열, 정근우, 최재훈, 강경학, 박윤철",SK,"노수광, 한동민, 최정, 로맥, 고종욱, 정의윤, 이재원, 최항, 김성현, 박종훈",5 , 1
20190711,삼성,"김상수, 박해민, 이원석, 러프, 이학주, 김동엽, 강민호, 이성곤, 최영진, 헤일리",KIA,"김주찬, 박찬호, 터커, 최형우, 안치홍, 오선우, 이창진, 김민식, 오정환, 윌랜드",2 , 4
20190711,롯데,"민병헌, 오윤석, 윌슨, 전준우, 손아섭, 이대호, 전병우, 안중열, 신본기, 다익손",NC,"박민우, 이명기, 박석민, 스몰린스키, 노진혁, 모창민, 이원재, 김형준, 김태진, 구창모",4 , 0
20190712,LG,"이천웅, 전민수, 이형종, 김현수, 박용택, 김민성, 오지환, 유강남, 정주현, 차우찬",삼성,"김상수, 박해민, 이원석, 러프, 이학주, 김동엽, 강민호, 최영진, 박찬도, 원태인",6 , 3
20190712,SK,"노수광, 한동민, 최정, 로맥, 고종욱, 정의윤, 이재원, 김성현, 최준우, 김광현",키움,"이정후, 김하성, 송성문, 샌즈, 박동원, 임병욱, 장영석, 김혜성, 이지영, 브리검",6 , 2
20190712,KIA,"이창진, 박찬호, 터커, 최형우, 안치홍, 이우성, 유민상, 한승택, 김선빈, 양현종",한화,"정은원, 오선진, 송광민, 호잉, 김태균, 최재훈, 정근우, 노시환, 유장혁, 김범수",0 , 5
20190712,롯데,"민병헌, 강로한, 윌슨, 전준우, 손아섭, 이대호, 오윤석, 나종덕, 전병우, 레일리",두산,"박건우, 페르난데스, 최주환, 김재환, 오재일, 김재호, 허경민, 박세혁, 정수빈, 이용찬",1 , 2
20190712,NC,"이명기, 박민우, 스몰린스키, 박석민, 이원재, 모창민, 노진혁, 김형준, 김태진, 프리드릭",KT,"김민혁, 오태곤, 조용호, 유한준, 로하스, 황재균, 박경수, 장성우, 심우준, 알칸타라",8 , 9
20190713,LG,"이천웅, 오지환, 이형종, 김현수, 박용택, 김민성, 유강남, 김용의, 정주현, 윌슨",삼성,"김상수, 박해민, 이원석, 러프, 이학주, 김동엽, 강민호, 송준석, 박찬도, 윤성환",3 , 5
20190713,SK,"노수광, 한동민, 최정, 로맥, 고종욱, 김강민, 이재원, 최준우, 안상현, 산체스",키움,"이정후, 김하성, 임병욱, 샌즈, 송성문, 박동원, 김규민, 이지영, 김혜성, 최원태",2 , 4
20190713,KIA,"김주찬, 김선빈, 터커, 최형우, 안치홍, 이범호, 이우성, 오선우, 한승택, 홍건희",한화,"정은원, 오선진, 송광민, 호잉, 이성열, 김태균, 정근우, 최재훈, 장진혁, 서폴드",10 , 5
20190713,롯데,"민병헌, 오윤석, 전준우, 윌슨, 손아섭, 이대호, 강로한, 나종덕, 전병우, 장시환",두산,"박건우, 최주환, 오재일, 페르난데스, 김재환, 김재호, 허경민, 박세혁, 정수빈, 이영하",4 , 3
20190713,NC,"이명기, 박민우, 스몰린스키, 박석민, 이원재, 모창민, 노진혁, 김형준, 김태진, 루친스키",KT,"김민혁, 오태곤, 조용호, 유한준, 로하스, 윤석민, 박경수, 장성우, 심우준, 김민수",13 , 3
20190714,LG,"이천웅, 정주현, 이형종, 김현수, 박용택, 유강남, 김민성, 김용의, 오지환, 켈리",삼성,"김상수, 박해민, 이원석, 러프, 이학주, 김동엽, 백승민, 강민호, 박찬도, 백정현",0 , 2
20190714,SK,"김강민, 한동민, 최정, 로맥, 고종욱, 정의윤, 이재원, 나주환, 김성현, 소사",키움,"이정후, 김하성, 샌즈, 박동원, 송성문, 장영석, 임병욱, 박정음, 김혜성, 요키시",3 , 4
20190714,KIA,"김주찬, 김선빈, 터커, 안치홍, 이우성, 나지완, 이창진, 한승택, 박찬호, 터너",한화,"정은원, 오선진, 송광민, 호잉, 이성열, 김태균, 최재훈, 장진혁, 노시환, 채드벨",7 , 10
20190714,롯데,"민병헌, 김문호, 전준우, 윌슨, 손아섭, 이대호, 강로한, 나종덕, 신본기, 박세웅",두산,"박건우, 정수빈, 오재일, 김재환, 최주환, 허경민, 김재호, 박세혁, 오재원, 린드블럼",8 , 2
20190714,NC,"이명기, 박민우, 스몰린스키, 박석민, 모창민, 노진혁, 김태진, 손시헌, 김형준, 박진우",KT,"김민혁, 오태곤, 조용호, 유한준, 로하스, 윤석민, 박승욱, 장성우, 심우준, 김민",4 , 1
20190716,두산,"박건우, 최주환, 오재일, 김재환, 페르난데스, 허경민, 박세혁, 김재호, 정수빈, 후랭코프",KT,"김민혁, 오태곤, 조용호, 유한준, 로하스, 윤석민, 박승욱, 이준수, 심우준, 배제성",7 , 2
20190716,키움,"이정후, 김하성, 샌즈, 박병호, 송성문, 박동원, 임병욱, 이지영, 김혜성, 김선기",삼성,"김상수, 박해민, 이원석, 러프, 이학주, 김동엽, 이성곤, 강민호, 박찬도, 맥과이어",0 , 6
20190716,SK,"노수광, 한동민, 최정, 로맥, 고종욱, 김강민, 이재원, 최준우, 김성현, 문승원",LG,"이천웅, 오지환, 김현수, 페게로, 이형종, 박용택, 김민성, 유강남, 정주현, 임찬규",4 , 10
20190716,한화,"정은원, 양성우, 송광민, 호잉, 김태균, 강경학, 최재훈, 장진혁, 노시환, 박윤철",NC,"이명기, 박민우, 스몰린스키, 박석민, 이원재, 모창민, 노진혁, 김태진, 김형준, 이재학",3 , 2
20190717,두산,"박건우, 정수빈, 오재일, 김재환, 최주환, 김재호, 박세혁, 류지혁, 오재원, 유희관",KT,"김민혁, 오태곤, 조용호, 유한준, 로하스, 윤석민, 박승욱, 안승한, 심우준, 쿠에바스",6 , 4
20190717,키움,"이정후, 김하성, 샌즈, 박병호, 송성문, 박동원, 임병욱, 이지영, 김혜성, 신재영",삼성,"김상수, 박해민, 이학주, 러프, 김동엽, 이원석, 백승민, 강민호, 송준석, 헤일리",6 , 10
20190717,SK,"김강민, 노수광, 최정, 로맥, 고종욱, 정의윤, 나주환, 김성현, 허도환, 박종훈",LG,"이천웅, 신민재, 김현수, 페게로, 박용택, 전민수, 오지환, 유강남, 김민성, 이우찬",2 , 8
20190717,한화,"정은원, 오선진, 송광민, 호잉, 김태균, 이성열, 정근우, 최재훈, 유장혁, 김범수",NC,"이명기, 박민우, 스몰린스키, 박석민, 모창민, 강진성, 김태진, 김형준, 김찬형, 구창모",14 , 1
20190717,KIA,"김주찬, 김선빈, 터커, 최형우, 안치홍, 이우성, 이인행, 김민식, 박찬호, 윌랜드",롯데,"민병헌, 조홍석, 전준우, 이대호, 윌슨, 오윤석, 강로한, 안중열, 신본기, 다익손",1 , 3
20190718,두산,"정수빈, 페르난데스, 오재일, 김재환, 최주환, 박세혁, 오재원, 정진호, 김재호, 이용찬",KT,"김민혁, 오태곤, 조용호, 유한준, 로하스, 윤석민, 박승욱, 안승한, 심우준, 알칸타라",7 , 4
20190718,키움,"이정후, 김하성, 샌즈, 박병호, 송성문, 박동원, 임병욱, 이지영, 김혜성, 브리검",삼성,"박해민, 김성훈, 이원석, 러프, 김동엽, 이학주, 이성곤, 박찬도, 김도환, 원태인",1 , 5
20190718,SK,"김강민, 노수광, 최정, 로맥, 정의윤, 김성민, 이현석, 정현, 최준우, 이원준",LG,"이천웅, 오지환, 김현수, 페게로, 채은성, 박용택, 김민성, 유강남, 정주현, 차우찬",12 , 5
20190718,한화,"정은원, 오선진, 송광민, 호잉, 김태균, 이성열, 정근우, 최재훈, 유장혁, 서폴드",NC,"이명기, 박민우, 스몰린스키, 박석민, 모창민, 노진혁, 강진성, 이원재, 김형준, 프리드릭",7 , 4
20190718,KIA,"김주찬, 김선빈, 터커, 최형우, 안치홍, 이우성, 이창진, 한승택, 박찬호, 양현종",롯데,"민병헌, 조홍석, 윌슨, 이대호, 손아섭, 오윤석, 강로한, 나종덕, 배성근, 레일리",6 , 3
20190726,키움,"이정후, 김하성, 샌즈, 박병호, 송성문, 박동원, 임병욱, 이지영, 김혜성, 브리검",NC,"이명기, 박민우, 스몰린스키, 박석민, 모창민, 노진혁, 이원재, 김형준, 김태진, 루친스키",4 , 5
20190726,삼성,"김상수, 박해민, 김헌곤, 러프, 이원석, 이학주, 김동엽, 강민호, 이성곤, 맥과이어",한화,"정은원, 양성우, 송광민, 호잉, 김태균, 이성열, 장진혁, 최재훈, 오선진, 장민재",8 , 9
20190726,롯데,"민병헌, 손아섭, 전준우, 이대호, 윌슨, 정훈, 신본기, 안중열, 강로한, 다익손",SK,"노수광, 한동민, 최정, 로맥, 고종욱, 정의윤, 이재원, 최준우, 김성현, 김광현",8 , 6
20190727,두산,"박건우, 페르난데스, 오재일, 김재환, 최주환, 허경민, 박세혁, 김재호, 정수빈, 이영하",KIA,"김주찬, 김선빈, 터커, 최형우, 안치홍, 나지완, 이창진, 한승택, 박찬호, 터너",1 , 12
20190727,키움,"이정후, 김하성, 샌즈, 박병호, 박동원, 송성문, 이지영, 임병욱, 장영석, 최원태",NC,"이명기, 김태진, 박민우, 스몰린스키, 박석민, 모창민, 노진혁, 손시헌, 김형준, 구창모",1 , 4
20190727,KT,"김민혁, 오태곤, 조용호, 유한준, 로하스, 박경수, 윤석민, 장성우, 심우준, 쿠에바스",LG,"이천웅, 오지환, 김현수, 페게로, 채은성, 박용택, 김민성, 유강남, 정주현, 윌슨",5 , 2
20190727,삼성,"김상수, 박해민, 김헌곤, 러프, 이원석, 윌리엄슨, 김동엽, 강민호, 이학주, 백정현",한화,"정은원, 오선진, 송광민, 호잉, 김태균, 이성열, 최재훈, 장진혁, 노시환, 채드벨",6 , 7
20190727,롯데,"민병헌, 손아섭, 전준우, 이대호, 윌슨, 김문호, 신본기, 안중열, 강로한, 레일리",SK,"김강민, 고종욱, 최정, 로맥, 이재원, 정의윤, 나주환, 김성현, 노수광, 소사",4 , 0
20190728,키움,"이정후, 김하성, 샌즈, 박병호, 박동원, 송성문, 이지영, 임병욱, 김혜성, 이승호",NC,"박민우, 이명기, 스몰린스키, 박석민, 모창민, 강진성, 김형준, 김찬형, 김성욱, 프리드릭",11 , 0
20190728,KT,"김민혁, 오태곤, 조용호, 유한준, 로하스, 박경수, 윤석민, 장성우, 심우준, 김민수",LG,"이천웅, 오지환, 김현수, 페게로, 채은성, 박용택, 김민성, 유강남, 정주현, 켈리",10 , 1
20190728,삼성,"김상수, 박해민, 김헌곤, 러프, 이원석, 윌리엄슨, 김동엽, 강민호, 이학주, 원태인",한화,"정은원, 양성우, 호잉, 이성열, 김태균, 송광민, 장진혁, 최재훈, 오선진, 김범수",6 , 13
20190728,롯데,"민병헌, 손아섭, 전준우, 이대호, 윌슨, 김문호, 신본기, 나종덕, 강로한, 장시환",SK,"노수광, 한동민, 최정, 이재원, 고종욱, 정의윤, 나주환, 최준우, 김성현, 산체스",3 , 0
20190730,LG,"이천웅, 이형종, 김현수, 페게로, 채은성, 유강남, 오지환, 김민성, 정주현, 차우찬",키움,"이정후, 김하성, 샌즈, 박병호, 송성문, 박동원, 임병욱, 이지영, 김혜성, 요키시",4 , 2
20190730,SK,"김강민, 고종욱, 최정, 로맥, 이재원, 정의윤, 나주환, 김성현, 노수광, 박종훈",KIA,"이창진, 박찬호, 터커, 최형우, 안치홍, 유민상, 이인행, 한승택, 황윤호, 양현종",2 , 0
20190730,KT,"김진곤, 오태곤, 조용호, 문상철, 로하스, 박경수, 박승욱, 장성우, 심우준, 알칸타라",한화,"정은원, 오선진, 호잉, 이성열, 김태균, 송광민, 장진혁, 최재훈, 정근우, 서폴드",2 , 3
20190730,삼성,"김상수, 박해민, 김헌곤, 러프, 이원석, 윌리엄슨, 김동엽, 강민호, 이학주, 윤성환",롯데,"민병헌, 손아섭, 전준우, 이대호, 채태인, 윌슨, 신본기, 나종덕, 강로한, 서준원",2 , 5
20190730,NC,"박민우, 노진혁, 스몰린스키, 박석민, 모창민, 강진성, 김태진, 김찬형, 김형준, 이재학",두산,"박건우, 페르난데스, 오재일, 김재환, 최주환, 허경민, 김재호, 박세혁, 정수빈, 린드블럼",9 , 1
20190731,LG,"이천웅, 오지환, 김현수, 페게로, 채은성, 박용택, 김민성, 이성우, 정주현, 류제국",키움,"이정후, 김하성, 샌즈, 박병호, 송성문, 박동원, 임병욱, 박정음, 김혜성, 김선기",8 , 0
20190731,SK,"노수광, 한동민, 최정, 로맥, 이재원, 고종욱, 정의윤, 최준우, 김성현, 문승원",KIA,"안치홍, 박찬호, 터커, 최형우, 유민상, 나지완, 이창진, 김민식, 황윤호, 윌랜드",6 , 2
20190731,KT,"심우준, 오태곤, 조용호, 윤석민, 로하스, 박경수, 문상철, 장성우, 강민국, 김민",한화,"정은원, 오선진, 호잉, 이성열, 김태균, 송광민, 정근우, 최재훈, 장진혁, 임준섭",5 , 2
20190731,삼성,"김상수, 박해민, 김헌곤, 러프, 이원석, 윌리엄슨, 김동엽, 강민호, 이학주, 김윤수",롯데,"민병헌, 손아섭, 전준우, 이대호, 채태인, 윌슨, 신본기, 안중열, 강로한, 박세웅",8 , 4
20190731,NC,"이명기, 김태진, 박민우, 스몰린스키, 박석민, 모창민, 김찬형, 김성욱, 김형준, 최성영",두산,"박건우, 페르난데스, 오재일, 김재환, 최주환, 허경민, 김재호, 박세혁, 정수빈, 이용찬",4 , 8
20190801,LG,"이천웅, 오지환, 김현수, 페게로, 채은성, 박용택, 김민성, 유강남, 정주현, 이우찬",키움,"이정후, 김하성, 샌즈, 박병호, 송성문, 박동원, 임병욱, 이지영, 김혜성, 브리검",5 , 11
20190801,SK,"노수광, 한동민, 최정, 로맥, 이재원, 고종욱, 정의윤, 최준우, 김성현, 김광현",KIA,"박찬호, 김선빈, 터커, 최형우, 이우성, 안치홍, 이창진, 백용환, 황윤호, 홍건희",1 , 10
20190801,KT,"심우준, 오태곤, 조용호, 문상철, 로하스, 박경수, 장성우, 박승욱, 배정대, 배제성",한화,"정은원, 오선진, 호잉, 이성열, 김태균, 송광민, 정근우, 최재훈, 장진혁, 채드벨",3 , 1
20190801,삼성,"김상수, 박해민, 김헌곤, 러프, 이원석, 이학주, 김동엽, 강민호, 이성곤, 맥과이어",롯데,"민병헌, 손아섭, 전준우, 이대호, 채태인, 윌슨, 신본기, 안중열, 강로한, 박시영",9 , 4
20190801,NC,"이명기, 김태진, 박민우, 스몰린스키, 박석민, 모창민, 김찬형, 김성욱, 정범모, 루친스키",두산,"박건우, 최주환, 오재일, 김재환, 페르난데스, 허경민, 김재호, 박세혁, 정수빈, 후랭코프",3 , 2
20190803,LG,"이천웅, 오지환, 김현수, 페게로, 채은성, 박용택, 김민성, 유강남, 정주현, 윌슨",삼성,"김상수, 박해민, 러프, 이원석, 윌리엄슨, 김헌곤, 김동엽, 강민호, 이학주, 원태인",10 , 13
20190803,키움,"이정후, 김하성, 샌즈, 박병호, 송성문, 서건창, 박동원, 임병욱, 김혜성, 최원태",KT,"김진곤, 오태곤, 조용호, 유한준, 로하스, 박경수, 박승욱, 안승한, 심우준, 쿠에바스",7 , 1
20190803,한화,"정은원, 정근우, 호잉, 이성열, 김태균, 송광민, 오선진, 최재훈, 장진혁, 장민재",SK,"노수광, 한동민, 최정, 로맥, 이재원, 고종욱, 정의윤, 최준우, 김성현, 소사",3 , 0
20190803,KIA,"박찬호, 김선빈, 터커, 최형우, 안치홍, 김주찬, 이우성, 한승택, 이창진, 임기영",NC,"박민우, 이명기, 스몰린스키, 박석민, 이원재, 노진혁, 김태진, 김성욱, 김형준, 구창모",1 , 5
20190803,롯데,"민병헌, 손아섭, 전준우, 이대호, 채태인, 윌슨, 신본기, 안중열, 강로한, 레일리",두산,"박건우, 최주환, 오재일, 김재환, 페르난데스, 허경민, 김재호, 장승현, 정수빈, 유희관",1 , 2
20190804,LG,"이천웅, 오지환, 김현수, 페게로, 채은성, 박용택, 김민성, 유강남, 정주현, 켈리",삼성,"박해민, 이학주, 러프, 이원석, 윌리엄슨, 김헌곤, 김동엽, 김민수, 김호재, 윤성환",2 , 1
20190804,키움,"이정후, 김하성, 서건창, 박병호, 샌즈, 송성문, 임병욱, 이지영, 김혜성, 이승호",KT,"배정대, 오태곤, 조용호, 유한준, 로하스, 박경수, 윤석민, 장성우, 심우준, 김민수",5 , 3
20190804,한화,"정은원, 강경학, 김태균, 호잉, 이성열, 송광민, 장진혁, 최재훈, 오선진, 서폴드",SK,"노수광, 한동민, 최정, 로맥, 이재원, 고종욱, 김강민, 나주환, 김성현, 산체스",2 , 8
20190804,KIA,"박찬호, 김선빈, 터커, 최형우, 안치홍, 김주찬, 이우성, 한승택, 이창진, 양현종",NC,"이상호, 이명기, 박민우, 스몰린스키, 모창민, 강진성, 김찬형, 손시헌, 김형준, 프리드릭",0 , 1
20190804,롯데,"민병헌, 손아섭, 전준우, 이대호, 채태인, 윌슨, 문규현, 안중열, 강로한, 장시환",두산,"정수빈, 최주환, 오재일, 김재환, 페르난데스, 오재원, 정진호, 장승현, 류지혁, 이영하",4 , 9
20190806,두산,"박건우, 정수빈, 오재일, 김재환, 페르난데스, 최주환, 허경민, 박세혁, 김재호, 린드블럼",한화,"정은원, 정근우, 호잉, 김태균, 이성열, 송광민, 장진혁, 최재훈, 오선진, 임준섭",3 , 8
20190806,SK,"노수광, 한동민, 최정, 로맥, 고종욱, 정의윤, 나주환, 김성현, 허도환, 박종훈",KT,"김진곤, 오태곤, 조용호, 유한준, 로하스, 박경수, 박승욱, 장성우, 심우준, 알칸타라",3 , 0
20190806,KIA,"박찬호, 김선빈, 터커, 최형우, 안치홍, 김주찬, 이우성, 이창진, 김민식, 윌랜드",LG,"이천웅, 오지환, 김현수, 페게로, 채은성, 박용택, 김민성, 유강남, 정주현, 차우찬",17 , 4
20190807,두산,"허경민, 정수빈, 박건우, 오재일, 페르난데스, 김재호, 박세혁, 신성현, 오재원, 이용찬",한화,"정은원, 강경학, 호잉, 김태균, 이성열, 송광민, 장진혁, 최재훈, 오선진, 채드벨",7 , 5
20190807,SK,"노수광, 한동민, 최정, 로맥, 고종욱, 이재원, 정의윤, 나주환, 김성현, 문승원",KT,"김진곤, 오태곤, 조용호, 유한준, 로하스, 박경수, 박승욱, 장성우, 강민국, 김민",2 , 5
20190807,KIA,"박찬호, 김선빈, 터커, 최형우, 유민상, 안치홍, 김주찬, 김민식, 이창진, 김기훈",LG,"이천웅, 이형종, 김현수, 페게로, 채은성, 김민성, 오지환, 이성우, 정주현, 류제국",5 , 10
20190807,롯데,"민병헌, 손아섭, 전준우, 이대호, 채태인, 윌슨, 고승민, 안중열, 강로한, 다익손",키움,"서건창, 김하성, 이정후, 박병호, 샌즈, 송성문, 임병욱, 김혜성, 박동원, 김선기",16 , 4
20190807,NC,"박민우, 이명기, 스몰린스키, 박석민, 모창민, 권희동, 노진혁, 김찬형, 김형준, 이재학",삼성,"김상수, 박해민, 러프, 이원석, 윌리엄슨, 김헌곤, 김동엽, 강민호, 이학주, 백정현",1 , 2
20190808,두산,"박건우, 정수빈, 오재일, 김재환, 페르난데스, 최주환, 허경민, 박세혁, 김재호, 후랭코프",KT,"조용호, 오태곤, 강백호, 유한준, 로하스, 박승욱, 윤석민, 장성우, 심우준, 배제성",2 , 7
20190808,키움,"서건창, 김하성, 이정후, 박병호, 샌즈, 송성문, 임병욱, 김혜성, 이지영, 브리검",SK,"노수광, 한동민, 최정, 로맥, 고종욱, 이재원, 정의윤, 나주환, 김성현, 김광현",6 , 1
20190808,삼성,"김상수, 박해민, 러프, 이원석, 윌리엄슨, 이학주, 김동엽, 강민호, 김헌곤, 최채흥",롯데,"정훈, 손아섭, 전준우, 이대호, 윌슨, 민병헌, 김동한, 안중열, 강로한, 서준원",8 , 0
20190808,KIA,"박찬호, 김선빈, 터커, 최형우, 유민상, 안치홍, 김주찬, 김민식, 이창진, 터너",한화,"정은원, 장진혁, 호잉, 이성열, 정근우, 송광민, 최재훈, 김민하, 오선진, 김이환",2 , 5
